{"schema_version":"1","tool_version":"0.2.1","delta_model_version":"0.2.1","baseline":{"artifact_role":"baseline","schema_version":"1","lean_version":"4.30.0-rc2","policy_identifier":"strict","transparency_mode":"none","declarations":3},"current":{"artifact_role":"current","schema_version":"1","lean_version":"4.30.0-rc2","policy_identifier":"strict","transparency_mode":"none","declarations":3},"summary":{"baseline_declarations":3,"current_declarations":3,"declarations_added":1,"declarations_removed":1,"declarations_changed":2,"policy_result_changed":1,"finding_categories_changed":2,"boundary_shape_changed":1},"changes":[{"target":"Example.added","change_kind":"added","baseline_policy_result":null,"current_policy_result":"fail","policy_result_changed":false,"baseline_finding_categories":[],"current_finding_categories":["direct_prop"],"finding_categories_changed":false,"baseline_boundary_shape":[],"current_boundary_shape":[{"name":"h","binder_kind":"explicit","primary_category":"direct_prop","binder_type_repr":"sort(0)"}],"boundary_shape_changed":false},{"target":"Example.explicit","change_kind":"changed","baseline_policy_result":"fail","current_policy_result":"fail","policy_result_changed":false,"baseline_finding_categories":["direct_prop"],"current_finding_categories":["package_with_prop_fields"],"finding_categories_changed":true,"baseline_boundary_shape":[{"name":"h","binder_kind":"explicit","primary_category":"direct_prop","binder_type_repr":"sort(0)"}],"current_boundary_shape":[{"name":"pkg","binder_kind":"explicit","primary_category":"package_with_prop_fields","binder_type_repr":"const(Example.Package,[])"}],"boundary_shape_changed":true},{"target":"Example.hidden","change_kind":"changed","baseline_policy_result":"fail","current_policy_result":"pass","policy_result_changed":true,"baseline_finding_categories":["package_with_prop_fields"],"current_finding_categories":[],"finding_categories_changed":true,"baseline_boundary_shape":[{"name":"pkg","binder_kind":"explicit","primary_category":"package_with_prop_fields","binder_type_repr":"const(Example.Package,[])"}],"current_boundary_shape":[{"name":"pkg","binder_kind":"explicit","primary_category":"package_with_prop_fields","binder_type_repr":"const(Example.Package,[])"}],"boundary_shape_changed":false},{"target":"Example.removed","change_kind":"removed","baseline_policy_result":"pass","current_policy_result":null,"policy_result_changed":false,"baseline_finding_categories":[],"current_finding_categories":[],"finding_categories_changed":false,"baseline_boundary_shape":[{"name":"n","binder_kind":"explicit","primary_category":"pure_data","binder_type_repr":"const(Nat,[])"}],"current_boundary_shape":[],"boundary_shape_changed":false}],"limitations":["compares rendered audit artifacts only","does not re-run Lean elaboration","does not validate proof axioms","does not sandbox Lean execution","does not prove theorem-statement equivalence","does not suggest remediation"]}
